wandb: Currently logged in as: mason-nakamura1 (ecrl). Use `wandb login --relogin` to force relogin
wandb: Currently logged in as: mason-nakamura1 (ecrl). Use `wandb login --relogin` to force relogin
wandb: Currently logged in as: mason-nakamura1 (ecrl). Use `wandb login --relogin` to force relogin
wandb: wandb version 0.16.5 is available!  To upgrade, please run:
wandb:  $ pip install wandb --upgrade
wandb: Tracking run with wandb version 0.14.2
wandb: Run data is saved locally in /nas/ucb/mason/ethically-compliant-rl/wandb/run-20240329_141229-bcxqfn4t
wandb: Run `wandb offline` to turn off syncing.
wandb: Syncing run resilient-dragon-44
wandb: ⭐️ View project at https://wandb.ai/ecrl/ppol-LIDAR-CNN
wandb: 🚀 View run at https://wandb.ai/ecrl/ppol-LIDAR-CNN/runs/bcxqfn4t
wandb: wandb version 0.16.5 is available!  To upgrade, please run:
wandb:  $ pip install wandb --upgrade
wandb: Tracking run with wandb version 0.14.2
wandb: Run data is saved locally in /nas/ucb/mason/ethically-compliant-rl/wandb/run-20240329_141229-6kklwifj
wandb: Run `wandb offline` to turn off syncing.
wandb: Syncing run radiant-night-45
wandb: ⭐️ View project at https://wandb.ai/ecrl/ppol-LIDAR-CNN
wandb: 🚀 View run at https://wandb.ai/ecrl/ppol-LIDAR-CNN/runs/6kklwifj
wandb: wandb version 0.16.5 is available!  To upgrade, please run:
wandb:  $ pip install wandb --upgrade
wandb: Tracking run with wandb version 0.14.2
wandb: Run data is saved locally in /nas/ucb/mason/ethically-compliant-rl/wandb/run-20240329_141229-yhs33tas
wandb: Run `wandb offline` to turn off syncing.
wandb: Syncing run gentle-firebrand-46
wandb: ⭐️ View project at https://wandb.ai/ecrl/ppol-LIDAR-CNN
wandb: 🚀 View run at https://wandb.ai/ecrl/ppol-LIDAR-CNN/runs/yhs33tas
Traceback (most recent call last):
  File "/nas/ucb/mason/ethically-compliant-rl/tests/PPOL_New/train_ppol_lidar_cnn.py", line 158, in <module>
    train()
  File "/nas/ucb/mason/ethically-compliant-rl/.venv/lib/python3.9/site-packages/pyrallis/argparsing.py", line 158, in wrapper_inner
    response = fn(cfg, *args, **kwargs)
  File "/nas/ucb/mason/ethically-compliant-rl/tests/PPOL_New/train_ppol_lidar_cnn.py", line 151, in train
    agent.learn(total_timesteps=args.total_timesteps, callback=callback, reset_num_timesteps=False)
  File "/nas/ucb/mason/ethically-compliant-rl/stable_baselines3/stable_baselines3/ppol/ppol.py", line 445, in learn
    result = super().learn(
  File "/nas/ucb/mason/ethically-compliant-rl/stable_baselines3/stable_baselines3/common/on_policy_algorithm.py", line 646, in learn
    self.train()
  File "/nas/ucb/mason/ethically-compliant-rl/stable_baselines3/stable_baselines3/ppol/ppol.py", line 248, in train
    for rollout_data in self.rollout_buffer.get(self.batch_size):
  File "/nas/ucb/mason/ethically-compliant-rl/stable_baselines3/stable_baselines3/common/buffers.py", line 903, in get
    yield self._get_samples(indices[start_idx : start_idx + batch_size])
  File "/nas/ucb/mason/ethically-compliant-rl/stable_baselines3/stable_baselines3/common/buffers.py", line 911, in _get_samples
    return DictRolloutBufferSamples(
TypeError: <lambda>() got an unexpected keyword argument 'old_values_costs'
wandb: Waiting for W&B process to finish... (failed 1). Press Control-C to abort syncing.
Traceback (most recent call last):
  File "/nas/ucb/mason/ethically-compliant-rl/tests/PPOL_New/train_ppol_lidar_cnn.py", line 158, in <module>
    train()
  File "/nas/ucb/mason/ethically-compliant-rl/.venv/lib/python3.9/site-packages/pyrallis/argparsing.py", line 158, in wrapper_inner
    response = fn(cfg, *args, **kwargs)
  File "/nas/ucb/mason/ethically-compliant-rl/tests/PPOL_New/train_ppol_lidar_cnn.py", line 151, in train
    agent.learn(total_timesteps=args.total_timesteps, callback=callback, reset_num_timesteps=False)
  File "/nas/ucb/mason/ethically-compliant-rl/stable_baselines3/stable_baselines3/ppol/ppol.py", line 445, in learn
    result = super().learn(
  File "/nas/ucb/mason/ethically-compliant-rl/stable_baselines3/stable_baselines3/common/on_policy_algorithm.py", line 646, in learn
    self.train()
  File "/nas/ucb/mason/ethically-compliant-rl/stable_baselines3/stable_baselines3/ppol/ppol.py", line 248, in train
    for rollout_data in self.rollout_buffer.get(self.batch_size):
  File "/nas/ucb/mason/ethically-compliant-rl/stable_baselines3/stable_baselines3/common/buffers.py", line 903, in get
    yield self._get_samples(indices[start_idx : start_idx + batch_size])
  File "/nas/ucb/mason/ethically-compliant-rl/stable_baselines3/stable_baselines3/common/buffers.py", line 911, in _get_samples
    return DictRolloutBufferSamples(
TypeError: <lambda>() got an unexpected keyword argument 'old_values_costs'
wandb: Waiting for W&B process to finish... (failed 1). Press Control-C to abort syncing.
Traceback (most recent call last):
  File "/nas/ucb/mason/ethically-compliant-rl/tests/PPOL_New/train_ppol_lidar_cnn.py", line 158, in <module>
    train()
  File "/nas/ucb/mason/ethically-compliant-rl/.venv/lib/python3.9/site-packages/pyrallis/argparsing.py", line 158, in wrapper_inner
    response = fn(cfg, *args, **kwargs)
  File "/nas/ucb/mason/ethically-compliant-rl/tests/PPOL_New/train_ppol_lidar_cnn.py", line 151, in train
    agent.learn(total_timesteps=args.total_timesteps, callback=callback, reset_num_timesteps=False)
  File "/nas/ucb/mason/ethically-compliant-rl/stable_baselines3/stable_baselines3/ppol/ppol.py", line 445, in learn
    result = super().learn(
  File "/nas/ucb/mason/ethically-compliant-rl/stable_baselines3/stable_baselines3/common/on_policy_algorithm.py", line 646, in learn
    self.train()
  File "/nas/ucb/mason/ethically-compliant-rl/stable_baselines3/stable_baselines3/ppol/ppol.py", line 248, in train
    for rollout_data in self.rollout_buffer.get(self.batch_size):
  File "/nas/ucb/mason/ethically-compliant-rl/stable_baselines3/stable_baselines3/common/buffers.py", line 903, in get
    yield self._get_samples(indices[start_idx : start_idx + batch_size])
  File "/nas/ucb/mason/ethically-compliant-rl/stable_baselines3/stable_baselines3/common/buffers.py", line 911, in _get_samples
    return DictRolloutBufferSamples(
TypeError: <lambda>() got an unexpected keyword argument 'old_values_costs'
wandb: Waiting for W&B process to finish... (failed 1). Press Control-C to abort syncing.
wandb: - 0.028 MB of 0.028 MB uploaded (0.000 MB deduped)wandb: \ 0.028 MB of 0.028 MB uploaded (0.000 MB deduped)wandb: | 0.028 MB of 0.028 MB uploaded (0.000 MB deduped)wandb: / 0.028 MB of 0.028 MB uploaded (0.000 MB deduped)wandb: 
wandb: Run history:
wandb:  avg_speed ▂▂▁▁▂▃▁▂▃▃▃▃▄▄▃▄▄▇▆▅▂▁▄▃▄▄▃▄▅▄▃▃▂▅▆▆▇█▇▁
wandb:       cost █▁▁▁▁▁▁▁▁▁▁▁▁▁▁▁▁▁▁▁▁▁▁▁▁▁▁▁▁▁▁▁▁▁▁▁▁▁▁▁
wandb: is_success ▁▁▁▁▁▁▁▁▁▁▁▁▁▁▁▁▁▁▁▁▁▁▁▁▁▁▁▁▁▁▁▁▁▁▁▁▁▁▁▁
wandb:  max_speed ▂▂▁▁▂▃▁▂▃▃▃▃▄▄▃▄▄▇▆▅▂▁▄▃▄▄▃▄▅▄▃▃▂▅▆▆▇█▇▁
wandb:     reward ▆▆▆▅▄▃▂▂▃▅▇▆▆▅▄▄▃▃▁▂▆▅▄▃▄▄▄▅▅▄▄▄▃▄▄▂▃▄▃█
wandb: 
wandb: Run summary:
wandb:  avg_speed 0.43722
wandb:       cost 0
wandb: is_success 0
wandb:  max_speed 0.43722
wandb:     reward -0.16813
wandb: 
wandb: 🚀 View run resilient-dragon-44 at: https://wandb.ai/ecrl/ppol-LIDAR-CNN/runs/bcxqfn4t
wandb: Synced 5 W&B file(s), 0 media file(s), 2 artifact file(s) and 0 other file(s)
wandb: Find logs at: ./wandb/run-20240329_141229-bcxqfn4t/logs
wandb: - 0.028 MB of 0.028 MB uploaded (0.000 MB deduped)wandb: \ 0.028 MB of 0.028 MB uploaded (0.000 MB deduped)wandb: | 0.033 MB of 0.033 MB uploaded (0.000 MB deduped)wandb: 
wandb: Run history:
wandb:  avg_speed ▂▂▁▁▂▃▁▂▃▃▃▃▄▄▃▄▄▇▆▅▂▁▄▃▄▄▃▄▅▄▃▃▂▅▆▆▇█▇▁
wandb:       cost █▁▁▁▁▁▁▁▁▁▁▁▁▁▁▁▁▁▁▁▁▁▁▁▁▁▁▁▁▁▁▁▁▁▁▁▁▁▁▁
wandb: is_success ▁▁▁▁▁▁▁▁▁▁▁▁▁▁▁▁▁▁▁▁▁▁▁▁▁▁▁▁▁▁▁▁▁▁▁▁▁▁▁▁
wandb:  max_speed ▂▂▁▁▂▃▁▂▃▃▃▃▄▄▃▄▄▇▆▅▂▁▄▃▄▄▃▄▅▄▃▃▂▅▆▆▇█▇▁
wandb:     reward ▆▆▆▅▄▃▂▂▃▅▇▆▆▅▄▄▃▃▁▂▆▅▄▃▄▄▄▅▅▄▄▄▃▄▄▂▃▄▃█
wandb: 
wandb: Run summary:
wandb:  avg_speed 0.43722
wandb:       cost 0
wandb: is_success 0
wandb:  max_speed 0.43722
wandb:     reward -0.16813
wandb: 
wandb: 🚀 View run gentle-firebrand-46 at: https://wandb.ai/ecrl/ppol-LIDAR-CNN/runs/yhs33tas
wandb: Synced 5 W&B file(s), 0 media file(s), 0 artifact file(s) and 0 other file(s)
wandb: Find logs at: ./wandb/run-20240329_141229-yhs33tas/logs
wandb: - 0.028 MB of 0.028 MB uploaded (0.000 MB deduped)wandb: \ 0.028 MB of 0.028 MB uploaded (0.000 MB deduped)wandb: | 0.028 MB of 0.028 MB uploaded (0.000 MB deduped)wandb: / 0.028 MB of 0.028 MB uploaded (0.000 MB deduped)wandb: - 0.028 MB of 0.028 MB uploaded (0.000 MB deduped)wandb: 
wandb: Run history:
wandb:  avg_speed ▂▂▁▁▂▃▁▂▃▃▃▃▄▄▃▄▄▇▆▅▂▁▄▃▄▄▃▄▅▄▃▃▂▅▆▆▇█▇▁
wandb:       cost █▁▁▁▁▁▁▁▁▁▁▁▁▁▁▁▁▁▁▁▁▁▁▁▁▁▁▁▁▁▁▁▁▁▁▁▁▁▁▁
wandb: is_success ▁▁▁▁▁▁▁▁▁▁▁▁▁▁▁▁▁▁▁▁▁▁▁▁▁▁▁▁▁▁▁▁▁▁▁▁▁▁▁▁
wandb:  max_speed ▂▂▁▁▂▃▁▂▃▃▃▃▄▄▃▄▄▇▆▅▂▁▄▃▄▄▃▄▅▄▃▃▂▅▆▆▇█▇▁
wandb:     reward ▆▆▆▅▄▃▂▂▃▅▇▆▆▅▄▄▃▃▁▂▆▅▄▃▄▄▄▅▅▄▄▄▃▄▄▂▃▄▃█
wandb: 
wandb: Run summary:
wandb:  avg_speed 0.43722
wandb:       cost 0
wandb: is_success 0
wandb:  max_speed 0.43722
wandb:     reward -0.16813
wandb: 
wandb: 🚀 View run radiant-night-45 at: https://wandb.ai/ecrl/ppol-LIDAR-CNN/runs/6kklwifj
wandb: Synced 5 W&B file(s), 0 media file(s), 2 artifact file(s) and 0 other file(s)
wandb: Find logs at: ./wandb/run-20240329_141229-6kklwifj/logs
srun: error: ddpg.ist.berkeley.edu: task 0: Exited with exit code 1
srun: error: gan.ist.berkeley.edu: task 0: Exited with exit code 1
srun: error: dqn.ist.berkeley.edu: task 0: Exited with exit code 1
